{
  "schema_version": "1.0.0",
  "id": "b750a844-d126-4b32-9431-ffd36b246014",
  "title": "Comprehensive Front Desk Onboarding Guide for Hotels in Egypt",
  "version": "1.0.0",
  "language": "en",
  "country": "EG",
  "industry": "hotels",
  "department": "training",
  "tags": [
    "hotels",
    "training",
    "front-desk-onboarding"
  ],
  "priority": "high",
  "owner": "operations@organization.com",
  "last_updated": "2023-10-10T12:00:00Z",
  "content_type": "guide",
  "body": "### Front Desk Onboarding Guide for Hotels in Egypt\n\n#### Introduction\nWelcome to the Front Desk team! As the first point of contact for our guests, your role is crucial in setting the tone for their stay. This guide will provide you with the necessary knowledge and skills to excel in your position, ensuring a seamless and memorable experience for our guests.\n\n#### Learning Objectives\n- Understand the core responsibilities of the front desk staff.\n- Gain proficiency in using the Property Management System (PMS).\n- Learn effective communication skills for guest interaction.\n- Familiarize with hotel policies, including PCI-DSS compliance and local hospitality regulations.\n- Develop problem-solving skills to handle guest inquiries and complaints.\n\n#### Module 1: Introduction to Hotel Operations\n- Overview of the hotel's structure and key departments.\n- Understanding the guest journey from check-in to check-out.\n- Importance of maintaining brand standards and guest satisfaction.\n\n#### Module 2: Property Management System (PMS) Training\n- Navigating the PMS interface.\n- Managing reservations, check-ins, and check-outs.\n- Handling room assignments and special requests.\n- Generating daily reports and understanding RevPAR and ADR metrics.\n\n#### Module 3: Guest Interaction and Communication\n- Techniques for effective verbal and non-verbal communication.\n- Handling guest inquiries and providing concierge services.\n- Managing complaints and conflict resolution.\n- Cultural sensitivity and personalized guest service.\n\n#### Module 4: Compliance and Safety\n- Overview of PCI-DSS and guest data protection.\n- Understanding local hospitality licensing and fire safety codes.\n- ADA compliance and accessibility standards.\n\n#### Module 5: Practical Assessment\n- Role-playing scenarios to demonstrate learned skills.\n- Evaluation of PMS proficiency and guest interaction techniques.\n- Feedback session with senior front desk staff.\n\n#### Conclusion\nCompleting this onboarding program will equip you with the essential skills and knowledge to thrive in your role. Remember, your contribution is vital to our hotel's success and guest satisfaction.\n\n#### Additional Resources\n- PMS User Manual\n- Hotel Policies and Procedures Handbook\n- Emergency Contact List\n\n#### Feedback and Continuous Improvement\nWe encourage you to provide feedback on this onboarding process to help us improve and support your development further.",
  "description": "A detailed onboarding guide for new front desk staff in hotels, focusing on essential skills and knowledge for effective guest service in Egypt.",
  "status": "draft",
  "effective_date": "2023-10-10",
  "expiry_date": "2024-10-10",
  "review_date": "2024-04-10",
  "created_by": "operations@organization.com",
  "approved_by": "training.manager@organization.com",
  "source_url": "https://www.examplehoteltraining.com/frontdesk-onboarding",
  "attachments": [],
  "external_id": "FD-ONB-2023-EG",
  "locale_overrides": {},
  "word_count": 450,
  "reading_time_minutes": 5,
  "checksum": "sha256:ec6c70661d4e3bee715c2116e79382239bb09945fdb6445bc6a9450e14ab1f85"
}