{
  "schema_version": "1.0.0",
  "id": "b750a844-d126-4b32-9431-ffd36b246014",
  "title": "Effective Upsell Techniques Training for Hotel Staff in Egypt",
  "version": "1.0.0",
  "language": "en",
  "country": "EG",
  "industry": "hotels",
  "department": "training",
  "priority": "high",
  "owner": "operations@organization.com",
  "last_updated": "2023-10-14T12:00:00Z",
  "content_type": "guide",
  "body": "## Introduction\n\nThis training guide is designed to equip hotel staff in Egypt with effective upsell techniques to enhance guest experience, increase revenue, and optimize service delivery. Upselling is a critical skill that can significantly impact the hotel's RevPAR and ADR.\n\n## Learning Objectives\n\n1. Understand the concept and importance of upselling in the hotel industry.\n2. Identify key opportunities for upselling at various guest touchpoints.\n3. Develop personalized upsell strategies that align with guest preferences and hotel offerings.\n4. Enhance communication skills to effectively present upsell options to guests.\n5. Measure the success of upselling efforts and adjust strategies accordingly.\n\n## Module Structure\n\n### Module 1: Introduction to Upselling\n- **Objective:** Define upselling and its benefits for hotels.\n- **Content:** Overview of upselling, impact on RevPAR and ADR, case studies.\n- **Assessment:** Quiz on key concepts.\n\n### Module 2: Identifying Upsell Opportunities\n- **Objective:** Recognize potential upsell opportunities throughout the guest journey.\n- **Content:** Check-in, concierge services, F&B, room upgrades.\n- **Assessment:** Role-playing scenarios.\n\n### Module 3: Personalizing the Upsell\n- **Objective:** Tailor upsell offers to individual guest needs and preferences.\n- **Content:** Using guest data from PMS, understanding guest profiles, cultural considerations in Egypt.\n- **Assessment:** Practical exercises on customizing offers.\n\n### Module 4: Communication Skills for Upselling\n- **Objective:** Develop effective communication techniques for upselling.\n- **Content:** Active listening, persuasive language, handling objections.\n- **Assessment:** Interactive workshops.\n\n### Module 5: Measuring and Optimizing Upsell Performance\n- **Objective:** Evaluate the effectiveness of upselling strategies.\n- **Content:** Tracking metrics, feedback collection, strategy refinement.\n- **Assessment:** Analysis of upsell performance reports.\n\n## Competency Framework\n\n- **Beginner:** Understand basic upsell concepts and identify simple opportunities.\n- **Intermediate:** Develop personalized upsell strategies and communicate effectively with guests.\n- **Advanced:** Analyze upsell performance data and optimize strategies for maximum impact.\n\n## Onboarding Plan\n\n1. **Week 1:** Introduction to hotel operations and upselling basics.\n2. **Week 2:** In-depth training on identifying and personalizing upsell opportunities.\n3. **Week 3:** Communication skills workshops and practical role-playing.\n4. **Week 4:** Performance measurement and strategy optimization.\n\n## Conclusion\n\nUpselling is a vital skill for hotel staff that not only enhances guest satisfaction but also drives revenue growth. By mastering these techniques, staff can contribute significantly to the hotel's success in the competitive Egyptian market.",
  "tags": [
    "hotels",
    "training",
    "upsell-techniques-training"
  ],
  "checksum": "sha256:29ef998f0358941df35e600809108e551afab96503c02152f32704fcff750119",
  "description": "This document provides a comprehensive training guide on upsell techniques for hotel staff in Egypt, focusing on enhancing guest experience and optimizing revenue.",
  "status": "draft",
  "effective_date": "2023-10-15",
  "expiry_date": "2024-10-15",
  "review_date": "2024-04-15",
  "created_by": "Eunoia AI OS Knowledge Cloud",
  "approved_by": "Eunoia AI OS Knowledge Cloud",
  "word_count": 500,
  "reading_time_minutes": 5
}