{
  "schema_version": "1.0.0",
  "id": "3f5b2d4a-6c3e-4b9d-8a0f-1a2b3c4d5e6f",
  "title": "Safety Compliance Training for Hotel Staff in Egypt",
  "version": "1.0.0",
  "language": "en",
  "country": "EG",
  "industry": "hotels",
  "department": "training",
  "priority": "high",
  "owner": "operations@organization.com",
  "last_updated": "2023-11-24T10:00:00Z",
  "content_type": "guide",
  "body": "# Safety Compliance Training for Hotel Staff in Egypt\n\n## Introduction\nThis guide provides comprehensive training for hotel staff in Egypt to ensure compliance with safety regulations and standards. The training focuses on fire safety, emergency procedures, and health regulations, tailored to the unique requirements of the Egyptian hospitality industry.\n\n## Learning Objectives\n- Understand the legal and regulatory requirements for hotel safety in Egypt.\n- Identify potential safety hazards and implement preventive measures.\n- Execute emergency procedures effectively, including evacuation and first aid.\n- Maintain compliance with fire safety codes and health regulations.\n\n## Module 1: Understanding Safety Regulations\n### Overview\n- **Local Hospitality Licensing**: Overview of Egyptian licensing requirements.\n- **Fire Safety Codes**: Key elements of compliance, including fire alarms and extinguishers.\n- **Health and Safety Standards**: Guidelines for maintaining a safe and healthy environment.\n\n### Learning Outcomes\n- Explain the importance of adhering to local hospitality licensing.\n- Identify the components of fire safety equipment and their uses.\n- Describe health and safety standards applicable to hotel operations.\n\n## Module 2: Identifying and Preventing Hazards\n### Overview\n- **Common Hazards**: Slips, trips, falls, and electrical safety.\n- **Preventive Measures**: Routine inspections and maintenance.\n\n### Learning Outcomes\n- Recognize common workplace hazards in a hotel setting.\n- Implement strategies to mitigate identified risks.\n\n## Module 3: Emergency Procedures\n### Overview\n- **Evacuation Plans**: Developing and practicing evacuation routes.\n- **First Aid**: Basic first aid procedures and emergency contacts.\n\n### Learning Outcomes\n- Develop and communicate effective evacuation plans.\n- Administer basic first aid and contact emergency services.\n\n## Module 4: Fire Safety Compliance\n### Overview\n- **Fire Drills**: Conducting regular fire drills and training.\n- **Equipment Maintenance**: Ensuring fire safety equipment is operational.\n\n### Learning Outcomes\n- Conduct and evaluate fire drills for effectiveness.\n- Maintain and inspect fire safety equipment regularly.\n\n## Assessment Structure\n- **Quizzes**: Short quizzes at the end of each module to test knowledge retention.\n- **Practical Exercises**: Hands-on activities to demonstrate understanding of safety procedures.\n- **Final Assessment**: Comprehensive test covering all modules.\n\n## Conclusion\nEnsuring safety compliance is critical for the protection of guests and staff. This training equips hotel employees with the necessary skills and knowledge to uphold safety standards and respond effectively to emergencies.\n\n## Review and Feedback\n- **Scheduled Review Date**: Annually or as regulations change.\n- **Feedback Mechanism**: Anonymous surveys and feedback forms to improve training effectiveness.\n\n## Additional Resources\n- **Local Fire Department**: Contact details for emergency assistance.\n- **Health and Safety Authority**: Guidelines and updates on safety regulations.\n\n## Effective Date\nThis training program is effective immediately and should be incorporated into the onboarding process for all new hires and as part of ongoing staff development.\n",
  "tags": [
    "hotels",
    "training",
    "safety-compliance-training"
  ],
  "status": "draft",
  "effective_date": "2023-11-24",
  "expiry_date": "2024-11-24",
  "review_date": "2024-05-24",
  "created_by": "operations@organization.com",
  "approved_by": "operations@organization.com",
  "word_count": 500,
  "reading_time_minutes": 5,
  "checksum": "sha256:75ceab6e6567d77a472fa49739df560e3fb3b517e84686552f3ef33e82e0c15b"
}