{
  "schema_version": "1.0.0",
  "id": "f3a1c9b2-5d4e-4b7e-8f9b-7e4f9d9a6b1c",
  "title": "Service Excellence Program for Hotels in Egypt",
  "version": "1.0.0",
  "language": "en",
  "country": "EG",
  "industry": "hotels",
  "department": "training",
  "tags": [
    "hotels",
    "training",
    "service-excellence-program"
  ],
  "priority": "high",
  "owner": "operations@organization.com",
  "last_updated": "2023-10-21T12:00:00Z",
  "content_type": "guide",
  "body": "### Service Excellence Program Overview\n\nThe Service Excellence Program is designed to enhance the guest experience in hotels across Egypt by focusing on key areas such as guest interaction, operational efficiency, and adherence to brand standards. This program aims to equip hotel staff with the skills necessary to exceed guest expectations consistently.\n\n### Learning Objectives\n1. **Understand Guest Needs**: Develop the ability to anticipate and fulfill guest needs through effective communication and personalized service.\n2. **Operational Excellence**: Learn best practices in using the Property Management System (PMS) to streamline operations and improve the occupancy rate.\n3. **Brand Standards**: Ensure compliance with brand standards to maintain consistency in service delivery across all touchpoints.\n4. **Cultural Sensitivity**: Gain insights into Egyptian cultural norms and expectations to provide culturally sensitive service.\n5. **Problem-Solving Skills**: Enhance problem-solving skills to address guest concerns promptly and effectively.\n\n### Training Module Structure\n- **Module 1: Introduction to Service Excellence**\n  - Overview of the program\n  - Importance of service excellence in the hotel industry\n  - Key performance indicators: RevPAR, ADR, and occupancy rate\n\n- **Module 2: Guest Interaction Skills**\n  - Effective communication techniques\n  - Personalization of guest experiences\n  - Handling guest feedback and complaints\n\n- **Module 3: Operational Efficiency**\n  - Mastering the PMS for efficient check-in/check-out processes\n  - Coordination between front desk, housekeeping, and concierge\n  - Strategies for optimizing room nights and channel mix\n\n- **Module 4: Adherence to Brand Standards**\n  - Understanding and implementing brand guidelines\n  - Consistency in service delivery\n  - Monitoring and evaluation of service standards\n\n- **Module 5: Cultural Competence and Sensitivity**\n  - Overview of Egyptian cultural norms\n  - Tailoring services to meet cultural expectations\n  - Enhancing guest satisfaction through cultural awareness\n\n### Assessment Structure\n- **Quizzes**: Short quizzes at the end of each module to reinforce learning.\n- **Role-Playing Exercises**: Simulated guest interactions to practice skills in real-time scenarios.\n- **Feedback Sessions**: Regular feedback from trainers to identify areas for improvement.\n\n### Skill Progression\n- **Beginner**: Basic understanding of service excellence principles and guest interaction.\n- **Intermediate**: Proficient in using PMS and adhering to brand standards.\n- **Advanced**: Ability to handle complex guest issues and provide culturally sensitive service.\n\n### Onboarding Plan Template\n1. **Week 1**: Orientation and introduction to the hotel’s service standards.\n2. **Week 2**: Hands-on training with PMS and guest interaction simulations.\n3. **Week 3**: In-depth training on brand standards and cultural competence.\n4. **Week 4**: Assessment and certification of service excellence skills.\n\nThis program is essential for maintaining a competitive edge in the hospitality industry by ensuring that all staff members are equipped to deliver exceptional service that meets the diverse needs of guests in Egypt.",
  "description": "A comprehensive guide for implementing a Service Excellence Program in hotels, focusing on guest experience, operational efficiency, and cultural sensitivity in Egypt.",
  "status": "draft",
  "effective_date": "2023-11-01",
  "expiry_date": "2024-11-01",
  "review_date": "2024-05-01",
  "created_by": "operations@organization.com",
  "approved_by": "training@organization.com",
  "source_url": "https://example.com/service-excellence-program",
  "attachments": [],
  "external_id": "SEP-2023-EG",
  "locale_overrides": {},
  "word_count": 500,
  "reading_time_minutes": 4,
  "checksum": "sha256:39d02c4106ac4a2e0af23d2c989e4b0f6b054d3dc3548b9a872a366b9e285559"
}